Primary Clustering,,,Second Clustering,,,Comparison Values,,,Graph Tables,
Cluster 0,,,Cluster 0,,,Comparison Values,,,Primary Cluster 0 Table,
"VENKATASUBRAMANIAN, S.","""I work in algorithms and computational geometry, with a current focus on data mining and large-data (and large-dimension) geometric questions.""",,"VENKATASUBRAMANIAN, S.",Male,,jshat,0.15004290004290002,,Secondary Cluster Index,Count,
"Ramalingam, S.","""Computer Vision, Machine Learning, Robotics (Autonomous Driving applications), and Discrete Optimization""",,"Ramalingam, S.",Male,,purity,0.8809523809523809,,0,31,
"DE ST GERMAIN, H. J.","""Reverse Engineering and Constraint Optimization, Artificial Intelligence, technological aids for education""",,"KASERA, S. K.",Male,,fowlkes mallows index,0.7372524115780307,,1,5,
"YUKSEL, C.","""Computer Graphics -- physically-based simulation, image synthesis, GPU algorithms.""",,"DE ST GERMAIN, H. J.",Male,
"KOPTA, D. M.","""Ray tracing, computer graphics, computer architecture""",,"YUKSEL, C.",Male,,,,,Primary Cluster 1 Table,
"JENSEN, P. A.",na,,"KOPTA, D. M.",Male,,,,,Secondary Cluster Index,Count,
"BHASKARA, A.",Theoretical computer science and machine learning.,,"JENSEN, P. A.",Male,,,,,0,1,
"WIESE, J.","""Personal data, HCI""",,"BHASKARA, A.",Male,,,,,1,0,
"FLATT, M.",Practical and theoretical aspects of programming languages and programming environments.,,"WIESE, J.",Male,
"SRIKUMAR, V.",Machine Learning; Natural Language Processing,,"FLATT, M.",Male,,,,,Primary Cluster 2 Table,
"BRUNVAND, E. L.",Computer architecture and VLSI systems,,"SRIKUMAR, V.",Male,,,,,Secondary Cluster Index,Count,
"Jones, B.","""Computer graphics, physical simulation""",,"Hermans, T.",Male,,,,,0,2,
"BERZINS, M.",My research area is the study of novel computational algorithms for the numerical solution of partial differential equations (p.d.e.s).,,"VAN DER MERWE, J. E.",Male,,,,,1,0,
"ZACHARY, J. L.","""I do research into the application of computers to education, and I teach extensively at the undergraduate and graduate levels.""",,"BRUNVAND, E. L.",Male,
"HANSEN, C. D.","""Visualization, computer graphics, parallel computation, computer vision""",,"Jones, B.",Male,,,,,Primary Cluster 3 Table,
"LI, F.","""Database systems and large-scale data management systems for various data sources, formats, applications, and data processing environments. Security issues in data management.""",,"BERZINS, M.",Male,,,,,Secondary Cluster Index,Count,
"DENNING, T.","""Security and Privacy, Human-Centric Computing""",,"KAVAN, L.",Male,,,,,0,1,
"PARKER, D.",na,,"ZACHARY, J. L.",Male,,,,,1,0,
"ZHE, S.","""Probabilistic graphical models, Bayesian nonparametric, approximate inference, Bayesian deep learning, sparse learning, large-scale machine learning and kernel methods.""",,"HANSEN, C. D.",Male,
"JOHNSON, C. R.",Scientific Computing and Visualization,,"LI, F.",Male,,,,,Primary Cluster 4 Table,
"WHITAKER, R. T.","""Image processing, medical image analysis, data analysis and visualization, geometry processing""",,"STUTSMAN, R.",Male,,,,,Secondary Cluster Index,Count,
"Kessler, B.",Systems software and software engineering,,"ZHE, S.",Male,,,,,0,1,
"JOHNSON, D. E.","""Geometric computation, haptics, robotics, educational research""",,"JOHNSON, C. R.",Male,,,,,1,0,
"REGEHR, J.","""Embedded systems, sensor networks, static analysis, real-time systems, operating systems""",,"WHITAKER, R. T.",Male,
"BROWN, S. M.",Chemical Sensors; Neural Interfaces; Electronic Circuit Clocking; Circuit Design; High Performance Microprocessors; Mixed Signal Microprocessors; Biomedical Implants.,,"Kessler, B.",Male,,,,,Primary Cluster 5 Table,
"COHEN, E.","""Problems in modeling, graphics, and visualization which require geometric computation and analysis.""",,"JOHNSON, D. E.",Male,,,,,Secondary Cluster Index,Count,
"RILOFF, E. M.","""Natural language processing, information retrieval, and artificial intelligence""",,"REGEHR, J.",Male,,,,,0,1,
"SUNDAR, H.",Parallel algorithms; scientific computing; inverse problems; soft tissue and cardiovascular mechanics; image analysis,,"BROWN, S. M.",Male,,,,,1,0,
"HALL, M. W.","""Our research focuses on compiler-based approaches to obtaining high performance on state-of-the-art and experimental architectures, including multi-cores""",,"KIRBY II, R. M.",Male,
"Young, R.","""Artificial Intelligence, Video games, Interactive narrative""",,"SUNDAR, H.",Male,
"HOLLERBACH, J. M.","""Robotics, teleoperation, virtual reality, and human motor control""",,"Young, R.",Male,
"HENDERSON, T. C.",The long range goals of my research are to contribute to the understanding of human intelligence and to participate in the development of intelligent machine systems.,,"HOLLERBACH, J. M.",Male,
"PHILLIPS, J.","""Algorithms for Data Analytics: Handling Uncertainty, Computational Geometry, Data Mining, Machine Learning, Computational Statistics, Databases""",,"HENDERSON, T. C.",Male,
"GOPALAKRISHNAN, G.","""Dynamic formal verification of message passing (MPI) and thread programs, formal analysis/verification of protocols, Verification tool development""",,"PHILLIPS, J.",Male,
"Cardona-Rivera, R.","""Computational psychology, artificial intelligence, game design, interactive narrative""",,"GOPALAKRISHNAN, G.",Male,
"Bojnordi, M.","""Computer architecture, new memory technologies, high-performance memory systems, and energy-efficient computing.""",,"Cardona-Rivera, R.",Male,
,,,"Bojnordi, M.",Male,
Cluster 1,
"STUTSMAN, R.","""Distributed Systems, Operating Systems, and Databases""",,Cluster 1,
,,,"PARKER, D.",Female,
Cluster 2,,,"COHEN, E.",Female,
"VAN DER MERWE, J. E.","""Networking systems research including network management, control and operation, mobile networking, network evolution, network security and cloud computing.""",,"RILOFF, E. M.",Female,
"KASERA, S. K.","""Networks and systems - technologies, protocols and applications encompassing mobile and pervasive systems and wireless networks, network security and reliability""",,"HALL, M. W.",Female,
,,,"DENNING, T.",Female,
Cluster 3,
"Hermans, T.",Autonomous learning and perception in robots,

Cluster 4,
"KAVAN, L.",Computer graphics and animation.,

Cluster 5,
"KIRBY II, R. M.",Scientific computing and visualization,
